{
  "$schema": "http://json-schema.org/draft-07/schema#",
  "$id": "https://ai-manifest.org/schemas/ai-manifest-0.1.json",
  "title": "AI Manifest v0.1",
  "type": "object",
  "additionalProperties": false,
  "required": [
    "manifest_version",
    "provider",
    "servers",
    "capabilities",
    "auth"
  ],
  "properties": {
    "manifest_version": {
      "type": "string",
      "pattern": "^0\\.1(\\.\\d+)?$"
    },
    "provider": {
      "type": "object",
      "additionalProperties": false,
      "required": [
        "name"
      ],
      "properties": {
        "name": {
          "type": "string",
          "minLength": 1
        },
        "description": {
          "type": "string"
        },
        "homepage": {
          "type": "string",
          "format": "uri"
        }
      }
    },
    "spec": {
      "type": "object",
      "additionalProperties": false,
      "properties": {
        "openapi_url": {
          "type": "string",
          "format": "uri"
        },
        "schemas": {
          "type": "array",
          "items": {
            "type": "string",
            "format": "uri"
          }
        }
      }
    },
    "servers": {
      "type": "array",
      "minItems": 1,
      "items": {
        "type": "object",
        "additionalProperties": false,
        "required": [
          "type",
          "url"
        ],
        "properties": {
          "type": {
            "type": "string",
            "enum": [
              "rest",
              "mcp",
              "ws",
              "sse"
            ]
          },
          "url": {
            "type": "string",
            "format": "uri"
          }
        }
      }
    },
    "capabilities": {
      "type": "array",
      "minItems": 1,
      "items": {
        "type": "string",
        "pattern": "^(urn:agent:(skill|intent):[a-z0-9.-]+:[a-z0-9._-]+\\.v\\d+|[a-z0-9._:-]+)$"
      }
    },
    "resources": {
      "type": "array",
      "items": {
        "type": "object",
        "additionalProperties": false,
        "required": [
          "id",
          "uri"
        ],
        "properties": {
          "id": {
            "type": "string"
          },
          "uri": {
            "type": "string",
            "format": "uri"
          },
          "description": {
            "type": "string"
          }
        }
      }
    },
    "prompts": {
      "type": "array",
      "items": {
        "type": "object",
        "additionalProperties": false,
        "required": [
          "name",
          "content"
        ],
        "properties": {
          "name": {
            "type": "string"
          },
          "description": {
            "type": "string"
          },
          "input_schema": {
            "type": "object"
          },
          "content": {
            "type": "string"
          }
        }
      }
    },
    "auth": {
      "type": "object",
      "additionalProperties": false,
      "required": [
        "jwks_uri"
      ],
      "properties": {
        "jwks_uri": {
          "type": "string",
          "format": "uri"
        },
        "schemes": {
          "type": "array",
          "items": {
            "type": "string",
            "enum": [
              "none",
              "http",
              "bearer",
              "mtls",
              "oauth2",
              "sig-http",
              "jws",
              "cose"
            ]
          }
        }
      }
    },
    "receipts": {
      "type": "object",
      "additionalProperties": false,
      "properties": {
        "signature": {
          "type": "array",
          "items": {
            "type": "string",
            "enum": [
              "JWS",
              "COSE",
              "Ed25519",
              "EIP-191"
            ]
          }
        }
      }
    },
    "contact": {
      "type": "object",
      "additionalProperties": false,
      "properties": {
        "email": {
          "type": "string",
          "format": "email"
        },
        "url": {
          "type": "string",
          "format": "uri"
        },
        "policy": {
          "type": "string",
          "format": "uri"
        },
        "terms": {
          "type": "string",
          "format": "uri"
        }
      }
    }
  }
}